{
  "$schema": "https://json-schema.org/draft/2020-12/schema",
  "$id": "https://example.local/workflow-state.schema.json",
  "title": "Workflow State Registry",
  "type": "object",
  "required": [
    "schema_version",
    "task",
    "plan",
    "risks",
    "changed_files",
    "test_results",
    "debug_log",
    "execution",
    "checkpoints",
    "policy_summary"
  ],
  "additionalProperties": false,
  "$defs": {
    "nonEmptyString": {
      "type": "string",
      "minLength": 1
    },
    "path": {
      "type": "string",
      "pattern": "^[A-Za-z0-9._/\\\\-]+$"
    },
    "severity": {
      "type": "string",
      "enum": [
        "low",
        "medium",
        "high",
        "critical"
      ]
    },
    "isoDate": {
      "type": "string",
      "pattern": "^\\d{4}-\\d{2}-\\d{2}T\\d{2}:\\d{2}:\\d{2}Z$"
    },
    "workflow": {
      "type": "string",
      "enum": [
        "feature-workflow",
        "bugfix-workflow",
        "refactor-workflow",
        "release-workflow"
      ]
    },
    "stack": {
      "type": "string",
      "enum": [
        "sveltekit-web",
        "fastapi-api",
        "python-automation"
      ]
    },
    "taskStatus": {
      "type": "string",
      "enum": [
        "pending",
        "in_progress",
        "blocked",
        "done"
      ]
    },
    "runtimeState": {
      "type": "string",
      "enum": [
        "initialized",
        "intake_ready",
        "planned",
        "execution_ready",
        "executing",
        "validating",
        "repair_pending",
        "retrying",
        "replan_pending",
        "replanning",
        "rollback_pending",
        "rolling_back",
        "review_pending",
        "completed",
        "blocked",
        "escalated",
        "stopped"
      ]
    },
    "progressState": {
      "type": "string",
      "enum": [
        "meaningful_progress",
        "partial_progress",
        "no_progress",
        "regression"
      ]
    },
    "failureClass": {
      "type": "string",
      "enum": [
        "none",
        "transient_tool",
        "schema_violation",
        "state_violation",
        "check_failure",
        "dependency_violation",
        "architecture_violation",
        "scope_violation",
        "unsafe_change_risk",
        "non_deterministic_output",
        "missing_required_input",
        "repeated_no_progress",
        "rollback_failure"
      ]
    }
  },
  "properties": {
    "schema_version": {
      "type": "string",
      "const": "1.0"
    },
    "task": {
      "type": "object"
    },
    "plan": {
      "type": "object"
    },
    "risks": {
      "type": "object"
    },
    "changed_files": {
      "type": "object"
    },
    "test_results": {
      "type": "object"
    },
    "debug_log": {
      "type": "object"
    },
    "execution": {
      "type": "object",
      "required": [
        "schema_version",
        "execution_id",
        "task_id",
        "plan_id",
        "runtime_state",
        "current_actor",
        "current_step",
        "failure_class",
        "severity",
        "progress_state",
        "failure_signature",
        "attempt_counters",
        "last_known_good",
        "last_decision_id",
        "updated_at"
      ],
      "additionalProperties": false,
      "properties": {
        "schema_version": {
          "type": "string",
          "const": "1.0"
        },
        "execution_id": {
          "type": "string"
        },
        "task_id": {
          "type": "string"
        },
        "plan_id": {
          "type": "string"
        },
        "runtime_state": {
          "$ref": "#/$defs/runtimeState"
        },
        "current_actor": {
          "type": "string"
        },
        "current_step": {
          "type": "string"
        },
        "failure_class": {
          "$ref": "#/$defs/failureClass"
        },
        "severity": {
          "$ref": "#/$defs/severity"
        },
        "progress_state": {
          "$ref": "#/$defs/progressState"
        },
        "failure_signature": {
          "type": "string"
        },
        "attempt_counters": {
          "type": "object",
          "required": [
            "global",
            "phase",
            "same_failure_signature",
            "replans",
            "rollbacks",
            "actor_hops_without_validated_progress"
          ],
          "properties": {
            "global": {
              "type": "integer",
              "minimum": 0
            },
            "phase": {
              "type": "integer",
              "minimum": 0
            },
            "same_failure_signature": {
              "type": "integer",
              "minimum": 0
            },
            "replans": {
              "type": "integer",
              "minimum": 0
            },
            "rollbacks": {
              "type": "integer",
              "minimum": 0
            },
            "actor_hops_without_validated_progress": {
              "type": "integer",
              "minimum": 0
            }
          },
          "additionalProperties": false
        },
        "last_known_good": {
          "type": "object",
          "required": [
            "checkpoint_id",
            "task_state_ref",
            "verified_by",
            "recorded_at"
          ],
          "properties": {
            "checkpoint_id": {
              "type": "string"
            },
            "task_state_ref": {
              "$ref": "#/$defs/path"
            },
            "verified_by": {
              "type": "array",
              "items": {
                "type": "string"
              }
            },
            "recorded_at": {
              "$ref": "#/$defs/isoDate"
            }
          },
          "additionalProperties": false
        },
        "last_decision_id": {
          "type": "string"
        },
        "updated_at": {
          "$ref": "#/$defs/isoDate"
        }
      }
    },
    "checkpoints": {
      "type": "object",
      "required": [
        "schema_version",
        "task_id",
        "active_checkpoint_id",
        "items",
        "updated_at"
      ],
      "additionalProperties": false,
      "properties": {
        "schema_version": {
          "type": "string",
          "const": "1.0"
        },
        "task_id": {
          "type": "string"
        },
        "active_checkpoint_id": {
          "type": "string"
        },
        "items": {
          "type": "array",
          "items": {
            "type": "object",
            "required": [
              "checkpoint_id",
              "label",
              "state_ref",
              "changed_files",
              "verification",
              "recorded_at"
            ],
            "additionalProperties": false,
            "properties": {
              "checkpoint_id": {
                "type": "string"
              },
              "label": {
                "type": "string"
              },
              "state_ref": {
                "$ref": "#/$defs/path"
              },
              "changed_files": {
                "type": "array",
                "items": {
                  "$ref": "#/$defs/path"
                }
              },
              "verification": {
                "type": "array",
                "items": {
                  "type": "string"
                }
              },
              "recorded_at": {
                "$ref": "#/$defs/isoDate"
              }
            }
          }
        },
        "updated_at": {
          "$ref": "#/$defs/isoDate"
        }
      }
    },
    "policy_summary": {
      "type": "object",
      "required": [
        "policy_version",
        "runtime_state",
        "authorized_next_action",
        "authorized_next_actor",
        "stop_risk",
        "updated_at"
      ],
      "additionalProperties": false,
      "properties": {
        "policy_version": {
          "type": "string",
          "const": "1.0"
        },
        "runtime_state": {
          "$ref": "#/$defs/runtimeState"
        },
        "authorized_next_action": {
          "type": "string",
          "enum": [
            "continue",
            "retry",
            "replan",
            "rollback",
            "stop",
            "escalate",
            "review"
          ]
        },
        "authorized_next_actor": {
          "type": "string"
        },
        "stop_risk": {
          "$ref": "#/$defs/severity"
        },
        "updated_at": {
          "$ref": "#/$defs/isoDate"
        }
      }
    }
  }
}
