{
  "schema_version": "1.0",
  "task": {
    "task_id": "TASK-0001",
    "schema_version": "1.0",
    "title": "Normalize request",
    "command": "/intake",
    "status": "pending",
    "active_stack": "sveltekit-web",
    "workflow": "feature-workflow",
    "scope": {
      "summary": "Create an implementation-ready task",
      "in_scope": [],
      "out_of_scope": []
    },
    "acceptance_criteria_ids": [],
    "assumptions": [],
    "notes": [],
    "next_action": "Define acceptance criteria",
    "updated_at": "1970-01-01T00:00:00Z"
  },
  "plan": {
    "task_id": "TASK-0001",
    "schema_version": "1.0",
    "workflow": "feature-workflow",
    "bounded_increment": {
      "id": "INC-001",
      "title": "Increment 1",
      "summary": "Smallest valuable increment"
    },
    "allowed_paths": [],
    "candidate_files": [],
    "mandatory_checks": [],
    "acceptance_criteria": [],
    "dependencies": [],
    "retry_budget": {
      "syntax": 2,
      "tests": 2,
      "refactor": 1,
      "total": 5
    },
    "updated_at": "1970-01-01T00:00:00Z"
  },
  "risks": {
    "task_id": "TASK-0001",
    "schema_version": "1.0",
    "risks": [
      {
        "id": "RISK-001",
        "description": "No risks recorded yet",
        "severity": "low",
        "status": "open",
        "owner": "vc-planner",
        "mitigation": "Refine scope"
      }
    ],
    "updated_at": "1970-01-01T00:00:00Z"
  },
  "changed_files": {
    "task_id": "TASK-0001",
    "schema_version": "1.0",
    "files": [],
    "updated_at": "1970-01-01T00:00:00Z"
  },
  "test_results": {
    "task_id": "TASK-0001",
    "schema_version": "1.0",
    "checks": [],
    "summary": {
      "passed": 0,
      "failed": 0,
      "skipped": 0,
      "pending": 0
    },
    "updated_at": "1970-01-01T00:00:00Z"
  },
  "debug_log": {
    "task_id": "TASK-0001",
    "schema_version": "1.0",
    "entries": [],
    "retry_counters": {
      "syntax": 0,
      "tests": 0,
      "refactor": 0,
      "total": 0
    },
    "updated_at": "1970-01-01T00:00:00Z"
  },
  "execution": {
    "schema_version": "1.0",
    "execution_id": "EXEC-0001",
    "task_id": "TASK-0001",
    "plan_id": "INC-001",
    "runtime_state": "initialized",
    "current_actor": "vc-orchestrator",
    "current_step": "command-intake",
    "failure_class": "none",
    "severity": "low",
    "progress_state": "partial_progress",
    "failure_signature": "none",
    "attempt_counters": {
      "global": 0,
      "phase": 0,
      "same_failure_signature": 0,
      "replans": 0,
      "rollbacks": 0,
      "actor_hops_without_validated_progress": 0
    },
    "last_known_good": {
      "checkpoint_id": "CHK-0000",
      "task_state_ref": ".ai/state/workflow-state.json",
      "verified_by": [],
      "recorded_at": "1970-01-01T00:00:00Z"
    },
    "last_decision_id": "DEC-0000",
    "updated_at": "1970-01-01T00:00:00Z"
  },
  "checkpoints": {
    "schema_version": "1.0",
    "task_id": "TASK-0001",
    "active_checkpoint_id": "CHK-0000",
    "items": [
      {
        "checkpoint_id": "CHK-0000",
        "label": "initial-template-baseline",
        "state_ref": ".ai/state/workflow-state.json",
        "changed_files": [],
        "verification": [],
        "recorded_at": "1970-01-01T00:00:00Z"
      }
    ],
    "updated_at": "1970-01-01T00:00:00Z"
  },
  "policy_summary": {
    "policy_version": "1.0",
    "runtime_state": "initialized",
    "authorized_next_action": "continue",
    "authorized_next_actor": "vc-orchestrator",
    "stop_risk": "low",
    "updated_at": "1970-01-01T00:00:00Z"
  }
}
